record_id,version,phase,banner_type,banner_name,featured_characters,featured_weapons,start_date,end_date,timezone,source_url,source_type,announcement_date,status,notes,last_checked
ww-3.2-phase-2-character,3.2,Phase 2,character,Version 3.2 Phase 2,Sigrika|Qiuyuan,,2026-03-19 00:00,2026-04-09 23:59,See official notice,https://www.dearplayers.com/en-US/updates/wuthering-waves/2029859537004736723,official_social,2026-03-13,official,History row used for rerun context and recent phase spacing. Dates and lineup now point to the official 3.2 preview broadcast distribution chain instead of a media roundup.,2026-05-19
ww-3.3-phase-1-character,3.3,Phase 1,character,Version 3.3 Phase 1,Hiyuki|Mornye|Iuno,,2026-04-30 00:00,2026-05-21 23:59,See official notice,https://blog.playstation.com/2026/04/17/wuthering-waves-version-3-3-reverbs-from-the-end-of-galaxies-update-arrives-april-30/,official_site,2026-04-17,official,Current live phase on May 19 2026 according to public schedule and official 3.3 update announcement.,2026-05-19
ww-3.3-phase-1-weapon,3.3,Phase 1,weapon,Version 3.3 Phase 1 Weapons,,Frostburn|Starfield Calibrator|Moongazer's Sigil,2026-04-30 00:00,2026-05-21 23:59,See official notice,https://www.pcgamer.com/games/rpg/wuthering-waves-banner-next-current/,secondary_media,2026-04-30,official,Weapon banner names cross-checked against public banner trackers pending direct in-game reconfirmation.,2026-05-19
ww-3.3-phase-2-character,3.3,Phase 2,character,Version 3.3 Phase 2,Denia|Chisa|Phrolova,,2026-05-21 10:00,2026-06-07 11:59,See official notice,https://wutheringwaves.kurogames.com/en/main/news/detail/2966,official_site,2026-05-20,official,Current live phase verified against the official 3.3 Phase II convene notice and its published server-time schedule.,2026-05-28
ww-3.3-phase-2-weapon,3.3,Phase 2,weapon,Version 3.3 Phase 2 Weapons,,Forged Dwarf Star|Kumokiri|Lethean Elegy,2026-05-21 10:00,2026-06-07 11:59,See official notice,https://wutheringwaves.kurogames.com/en/main/news/detail/2966,official_site,2026-05-20,official,Weapon banner names and timing aligned to the official 3.3 Phase II convene notice instead of secondary media.,2026-05-28
ww-3.4-phase-1-preview,3.4,Phase 1,preview,Version 3.4 Preview,,,,,,https://www.dearplayers.com/en-PH/updates/wuthering-waves/2058850561991057878,official_social,2026-05-29,expected,The next banner-related checkpoint is the official Version 3.4 Preview Special Broadcast while the full phase lineup is still unconfirmed.,2026-05-28
